{
  "$schema": "../schemas/project-entrypoints.schema.json",
  "contractVersion": "project-entrypoints-v1",
  "canonicalEntry": "AGENTS.md",
  "projectArchitectureRef": "ARCHITECTURE.md",
  "harnessArchitectureRef": ".harness/ARCHITECTURE.md",
  "detectedEntries": [
    {
      "path": "AGENTS.md",
      "kind": "generic-agent",
      "harnessBlock": "present",
      "evidenceSource": "AGENTS.md"
    }
  ]
}
